<?xml version="1.0" ?>
<model xmlns:xsi="http://www.w3.org/2001/XMLSchema_instance" xsi:noNamespaceSchemaLocation="primex.xsd">
	<node name="topnet" type="Net" >
		<!-- RoutingSphere name=RoutingSphere_4 numRoutes=6  -->
		<node name="router1" type="Router" >
			<node name="ifr11" type="Interface" >
			</node>
			<node name="ifr12" type="Interface" >
				<attribute name="buffer_size" value="64000" />
			</node>
		</node>
		<node name="router2" type="Router" >
			<node name="ifr21" type="Interface" >
				<attribute name="buffer_size" value="64000" />
			</node>
			<node name="ifr22" type="Interface" >
			</node>
		</node>
		<node name="host1" type="Router" >
			<node name="if0" type="Interface" >
			</node>
			<node name="TCPMaster_17" type="TCPMaster" >
				<attribute name="mss" value="1448" />
				<attribute name="samplingInterval" value="0.1" />
				<attribute name="tcpCA" value="scalable" />
			</node>
		</node>
		<node name="host2" type="Router" >
			<node name="if0" type="Interface" >
			</node>
			<node name="TCPMaster_23" type="TCPMaster" >
				<attribute name="mss" value="1448" />
				<attribute name="samplingInterval" value="0.1" />
				<attribute name="tcpCA" value="scalable" />
			</node>
			<node name="HTTPServer_27" type="HTTPServer" >
			</node>
		</node>
		<node name="h1_router" type="Link" >
			<attribute name="bandwidth" value="1000000000" />
			<attribute name="delay" value="0.0" />
			<ref name="InterfaceAlias_31" path="..:host1:if0" />
			<ref name="InterfaceAlias_33" path="..:router1:ifr11" />
		</node>
		<node name="router_router" type="Link" >
			<attribute name="bandwidth" value="10000000" />
			<attribute name="delay" value="0.064" />
			<ref name="InterfaceAlias_38" path="..:router1:ifr12" />
			<ref name="InterfaceAlias_40" path="..:router2:ifr21" />
		</node>
		<node name="router_h2" type="Link" >
			<attribute name="bandwidth" value="1000000000" />
			<attribute name="delay" value="0.0" />
			<ref name="InterfaceAlias_45" path="..:router2:ifr22" />
			<ref name="InterfaceAlias_47" path="..:host2:if0" />
		</node>
		<node name="Traffic_49" type="Traffic" >
			<node name="TCPTraffic_50" type="TCPTraffic" >
				<attribute name="connections_per_session" value="1" />
				<attribute name="dst_port" value="80" />
				<attribute name="dsts" value=".:host2" />
				<attribute name="file_size" value="70000000" />
				<attribute name="session_timeout" value="3000" />
				<attribute name="srcs" value=".:host1" />
			</node>
		</node>
		<node name="3" type="ShortestPath" />
	</node>
</model>
